Link to paper,Score,text
https://www.aaai.org/ocs/index.php/ICWSM/ICWSM14/paper/viewPaper/8075,0,reddit is a social news website where registered user submit content in the form of link or text post user also known a redditors can then vote each submission up or down to rank the post and determine it position or prominence on the site page these two attribute associated with a post are referred to a upvotes and downvotes redditors can also comment on post and respond back in a conversation tree of comment content entry that is the post are organized by area of interest or subcommunities called subreddits such a politics programming or science a of reddits official statistic included billion page view million unique visitor post and comment httpblogredditcom toppostsofstatsandsnooyearshtml we used of reddits official api httpwwwredditcom dev api to collect post comment and associated metadata from several mental health subreddits specifically using a python wrapper praw httpsprawreadthedocsorgen latestindexhtml the subreddits we crawled were alcoholism anxiety bipolarreddit depression mentalhealth mmfb make me feel better socialanxiety suicidewatch all of these subreddits host public content in order to arrive at a comprehensive list of subreddits to focus on we utilized reddits native subreddit search feature httpwwwredditcomreddits and searched for subreddits on mental health two researcher familiar with reddit employed an initial filtering step on the search result returned so that we focus on high precision subreddits discussing mental health concern and issue thereafter we focused on a snowball approach in which starting with a few seed subreddits mentalhealth depression we compiled a second list of related or similar subreddits that are listed in the profile page of the seed subreddits following a second filtering step we arrived at the list of subreddits listed above for each of these subreddits we obtained daily crawl of their post in the new category corresponding to each post we collected information on the title of the post the body or textual content id timestamp when the post wa made author id and the number of upvotes and downvotes it obtained since post gather comment over a period of time following the time of sharing we crawled all of the comment per post that were shared over a three day period after the post wa made qualitative examination of the subreddits of interest revealed that or more of the comment to any post were typically made in a three day window following the time the post is madehence the choice the crawl of the subreddits used in this paper we present some descriptive statistic of our crawled data our dataset contained post with at least one comment and comment in all with unique user who made post comment or both a set of user were found to write both at least one post and comment cdf of the user distribution over post and comment is given in figure the figure show the expected heavy tail trend observed in several social phenomenon also see figure for the distribution of comment over time following post share it illustrates the quick responsivity culture in the community we study peak at hour some of the additional statistic of our dataset are given in table further example title of a few
https://dl.acm.org/doi/abs/10.1145/3025453.3025932,0,we utilized instagrams official api to obtain the dataset used in this paper each post in this dataset is public and contains postrelated information such a the image caption like comment hashtags filter and geolocation if tagged referring to prior literature we adopted an iterative approach to first identify a set of appropriate distinguishing hashtags around different prominent mental illness prevalent in social medium with the seed tag we performed an initial data collection of million post shared on instagram between dec and nov then by leveraging an association rule mining approach we compiled the top k k frequency cooccurring tag in the m post and then appended them to the original seed tag list for further data collection table list a sample set of tag used to crawl the dataset this final list of tag wa thereafter passed on to a psychiatry researcher to be categorized into different disorder type for tag that described experience or symptom crosscutting across different condition eg anxiety they were counted toward each disorder type table give a list of the ten different disorder identified in our data we additionally consulted the diagnostic and statistical manual of mental health disorder dsmv that indicates these disorder to be prominent mental health challenge in population this categorization of the mental health challenge wa conducted to ensure that our data used in the ensuing analysis focused on wellvalidated and clinically recognized condition at the same time it allowed u to focus on a diverse range of disorder expressed on social medium rather than specific one studied in prior work thus enabling u to discover generalized pattern in visual disclosure of mental health challenge in social medium our final crawl included post from user spanning these disorder
https://www.sciencedirect.com/science/article/pii/S0747563215300996,0,tweet about depression were collected by simply measured a company that specializes in social medium measurement and analytics simply measured simply measured ha access to the twitter firehose or full volume of tweet via gnip a licensed company that can retrieve the full twitter data stream all tweet in the english language that contained at least either depressed depressed depression or depression were collected between april and may we scanned a random sample of the tweet to identify common phrase that included our keywords of interest but were not about mental health in sa version sa institute inc cary nc we used the index function which search a character expression in this case the text of the tweet for a specific string of character to locate and remove such tweet from our sample we removed tweet that included the following term regardless of capitalization great depression economic depression during the depression depression era tropical depression and depressed real estate the popularity and influence of the tweeter wa described using the distribution of follower and klout score while number of follower is a measure of popularity klout score is a measure of influence klout score range from to with a higher score indicating higher influence klout score is calculated based on an algorithm that considers over signal from eight different online network example of signal include the amount of retweets a person generates in relation to the amount of tweet shared and the amount of engagement a user drive from unique individual eg lot of retweets from different individual a opposed to lot of retweets from one person klout inc
https://aclanthology.org/W15-1202.pdf,0,we follow the data acquisition and curation process of coppersmith et al a summarizing the major point here social medium such a twitter contains frequent public statement by user reporting diagnosis for various medical condition many talk about physical health condition eg cancer flu but some also discus mental illness including schizophrenia there are a variety of motivation for user to share this information on social medium to offer or seek support to fight the stigma of mental illness or perhaps to offer an explanation for certain behavior we obtain message with these selfreported diagnosis using the twitter api and filtered via caseinsensitive regular expression to require schizo or a close phonetic approximation to be present our expression matched schizophrenia it subtypes and various approximation schizo skitzo skitso schizotypal schizoid etc all data we collect are public post made between and and exclude any message marked a private by the author all use of the data reported in this paper ha been approved by the appropriate institutional review board irb each selfstated diagnosis included in this study wa examined by a human annotator one of the author to verify that it appeared to be a genuine statement of a schizophrenia diagnosis excluding joke quote or disingenuous statement we obtained user with an apparently genuine selfstated diagnosis of a schizophreniarelated condition note that we cannot be certain that the twitter user wa actually diagnosed with schizophrenia only that their statement of being diagnosed appears to be genuine previous work indicates that interannotator agreement for this task is good coppersmith et al a for each user we obtained a set of their public twitter post via the twitter api collecting up to tweet a we wish to focus on userauthored content we exclude from analysis all retweets and any tweet that contain a url which often contain text that the user did not author we lowercase all word and convert any nonstandard character including emoji to a systematic ascii representation via unidecode for our community control we used randomlyselected twitter user who primarily tweet in english specifically during a two week period in early each twitter user who wa included in twitter spritzer sample had an equal chance for inclusion in our pool of community control we then collected some of their historic tweet and assessed the language they tweeted in according to the chromium compact language detector user were excluded from our community control if their tweet were le than english
https://dl.acm.org/doi/abs/10.1145/2700171.2791026,1,privacy note all social medium data used in this paper are publicly available at no time did we contact or interact with a user given the sensitive nature of this research we took care to anonymize the data in analysis and presentation so a to minimize any inadvertent disclosure of personal information or information that may reveal cue about an individual online identity approval wa obtained from the relevant institutional review board
https://aclanthology.org/W17-3110.pdf,1,we briefly explain the data collection method here but we refer the interested reader with further question on the methodology to coppersmith et al for the suicide attempt data and coppersmith et al a for all other condition the data for these analysis are twitter post collected via two method most of the data come from user who have publicly discussed their mental health condition these user are frequently referred to a selfstated diagnosis user a they state publicly something like i wa diagnosed with schizophrenia or im so thankful to have survived my suicide attempt last year the data for user with a suicide attempt wa supplemented by data from ourdatahelpsorg a data donation site where people provide access to their public post and fill out a short questionnaire about their mental health history data are then deidentified and made available to researcher addressing question of interest to the mental health community donor provide consent for their data to be used in mental health research upon signup of the user who attempted suicide came from ourdatahelpsorg specifically we examine generalized anxiety disorder eating disorder panic attack schizophrenia and attempted suicide these condition were selected based on the theory that there are important timing aspect to their symptom ebbing and flowing of symptom a treatment is effective especially schizophrenia onset and exacerbation of symptom by external event and stress and punctuated event in time of psychological symptom suicide attempt panic attack and bingingpurging behavior with eating disorder we use the twitter streaming api to collect a sample of user who used a series of mental health word or phrase in their tweet text eg schizophrenia or suicide attempt each tweet that us one of these phrase is examined via regular expression to indicate that the user is talking about themselves finally those tweet that pas the regular expression are examined by a human to confirm to the best of our ability that their selfstatement of diagnosis appears to be genuine this result in a dataset with user that have a selfstated diagnosis of generalized anxiety disorder n an eating disorder panic attack schizophrenia or someone who would go on to attempt suicide some of these user do not exhibit the sort of posting behavior required to create micropatterns ie they rarely post multiple time within a hour time window we exclude these user from our analysis which is of user for most condition with the exception of those with a suicide attempt where a little over half the user do not exhibit this posting behavior the resultant dataset used for analysis is generalized anxiety disorder n eating disorder panic attack schizophrenia suicide attempt in order to allow comparison of each condition to control user we gather a random sample of twitter user for whom at least of their post are identified by twitter a english all the user with a selfstated diagnosis and all member of this control population have their age and gender estimated according to sap et al for each user with a selfstated diagnosis we find a matched control through the following procedure create a pool of user where the estimated gender match and the estimated age is within the same year bracket the suggested accuracy of the age estimator from that pool of age and gender matched user we select the user whose tweet start and end over the most similar timeframe we will refer to these age gender and timematched control simply a matched control throughout the rest of this paper all tweet were publicly posted by their author ie no user marked at protected or private were included on average user had tweet the distribution of estimated age and gender for user with each selfstated condition can be seen in figure for most condition the population skews female though for schizophrenia the gender are roughly balanced the average age tends to be in the earlytomid s
https://dl.acm.org/doi/abs/10.1145/2998181.2998220,1,next we also note that it is possible that our candidate control dataset includes user who engage in mental illness in their post however did not use any of the keyphrases from table to eliminate such user like above we compare the language used in the twitter post of these user with that of the reddit mental health post however in this case we are interested in the user whose language is most distinct or least similar from that used in the reddit content hence our final control dataset is obtained by filtering for those user whose language model based similarity is le than the median similarity across all control user vector user median distance see figure b for a distribution of the cosine cosine similarity we will refer to this dataset a ctl user ref figure for the approach
https://www.jmir.org/2019/6/e14199/,0,the selection of the tweet and their user wa based on the filtered realtime streaming support provided by the twitter api in the first step we selected the user who showed potential sign of depression on twitter on the basis of the most frequent word in spanish expressed by patient suffering from depression in clinical setting these word were jointly identified and selected by a psychologist and a family physician with clinical experience and were based on the definition and general feature of depression according to the diagnostic and statistical manual of mental disorder the list of word used and their english translation are shown in textbox during june tweet including or more occurrence of the word listed in textbox were collected from this collection of tweet and to select the user who publicly stated in the textual description associated to their profile that they suffered from depression all the profile description including or more occurrence of the word depr and all the possible derivation related to the word depression in spanish such a depre depresin depresivo depresiva deprimido and deprimida were considered from the user who included or more of these word in their description profile user who stated they suffered from depression or were receiving treatment for depression were selected for the analysis this selection wa performed by a psychologist verifying that the statement were related to real expression of depression excluding quote joke or fake one for each of these depressed twitter user we collected all the most recent tweet from their timeline up to a maximum of about tweet thus a total of tweet were collected a figure that wa reduced to after discarding the retweets these tweet constituted the depressive user dataset example of sentence appearing in the user profile that were used for selecting the depressive user are paciente psiquitrico con depresin crnica psychiatric patient with chronic depression example of a profile sentence that indicates depression colecciono errores traducidos a tweet depresivos y a uno que otro impulso de amor i gather error translated into depressing tweet and into one or another love impulse example of a profile sentence that doe not indicate depression once the user with profile sentence indicating depression had been retrieved their twitter timeline were collected only those user having in their timeline at least tweet that suggested sign of depression were retained for further analysis for each user the selection of these tweet wa performed by manually inspecting the tweet of the user complete timeline in reverse temporal order starting from the most recent one to the oldest tweet of the timeline retrieved by mean of the twitter api finally a total number of tweet issued by the depressive user suggesting sign of depression were detected and used for the analysis this set of tweet provided u with the depressive tweet dataset which wa used to analyze linguistic feature of tweet showing sign of depression it ha to be mentioned that these tweet were not to be included in the depressive user dataset see figure at the same time more than tweet were also collected in june such tweet were gathered by listening to the public twitter stream during this time span by only considering tweet with spanish textual content a detected by twitter language identification support given that twitter requires more restrictive filter than just the language of the tweet we used a list of the most frequently used spanish word stopwords to retrieve all tweet that included or more of these word the vast majority of spanish tweet should match this criterion a sample of user who did not mention in their profile the word depression and it derivation were selected randomly from the tweet the complete timeline of these user were compiled tweet which were reduced to once retweets were removed these tweet constituted the control dataset to identify the language of a tweet we relied on the language automatically identified by twitter for each tweet selecting tweet in spanish it ha to be noted that these data can contain some tweet from unidentified depressive user
https://aclanthology.org/W18-0608.pdf,1,data wa collected from cup of tea an anonymous online chatbased peer support community for emotional distress user agree at signup that their data may be used for the purpose of research all the data used for the current study wa anonymous and securely stored this research wa performed in line with the ethical and privacy protocol outlined in detail in benton et al data from cup take the form of written dialogue between user of the service and volunteer who are trained a active listener a fragment of an exchange between the user of the service u and the volunteer v might go a follows for the analysis reported in this paper we used only text generated by user of the service not the volunteer providing peer support user who reported depression a their primary concern at sign up were eligible for inclusion in analysis our original sample wa comprised of conversation involving unique user user were excluded from the sample if they did not indicate their culture or if they selected other this resulted in the exclusion of and user respectively the original sample also included user identifying a native american or american indian this group wa excluded from analysis since the majority of the data among these user wa not english this resulted in the removal of user leaving a total sample size of
https://dl.acm.org/doi/pdf/10.1145/3359169,1,all data analyzed in this study wa sourced with license and consent from the talklife and cup platform additionally to maintain user anonymity all personally identifiable information wa removed from the dataset before any finding were reported additionally all work wa approved by our institution institutional review board
https://bmcbioinformatics.biomedcentral.com/articles/10.1186/s12859-018-2197-z,0,in this section we first present the data gathered and used in our analysis researcher interested in the code and the data are invited to contact the author reddit is a website which enables user to aggregate rate and discus news entertainment politics and many other topic according to alexa it is the th most popular website in the world it wa estimated by the pew research center that of online adult use reddit the site is organized into a collection of subreddits each focused on a particular topic and administered by a collection of moderator the subreddit rsuicidewatch is a forum in which online user are encouraged to post their thought regarding suicide at the time of our data collection it had over subscriber sometimes user express a preoccupation with the thought of suicide other time user discus immediate plan to take their own life these post often contain a description of their mental state including depression reaction to stress their feeling of being alone and having a low selfesteem while most online source of data are notoriously noisy this particular subreddit is remarkably clean given the serious nature of the subreddit individual are le likely to post harassing comment or offtopic remark when user post such comment the moderator of the subreddit quickly remove them we collected all post from it inception in to each post is often commented on by other individual in this work we focused on the original post a it most often represents the suicidal ideation of a user and comment often represent emotional support from other user we cleaned this data first we removed empty post in which the content had been deleted second we removed link and replaced them with the word link third we concatenated the text of the post to the title a many user begin their post in the title and continue in the body of the post finally we removed punctuation and other special character after cleaning this data we had post with word of which word were unique posted by unique user
https://ieeexplore.ieee.org/abstract/document/8609647,0,reddit is a multilingual online social network founded in and organized in subcommunities by area of interest called subreddits we obtained data from the reddits data repository focusing on four subreddits where people discus issue related to mental heath disorder depression rdepression suicide watch rsuicide watch anxiety ranxiety and bipolar rbipolar our dataset is comprised of user activity post and comment that took place between and here we focus on data from january to december in total we obtained post and comment from unique user table i show the total number of user post and comment per subreddit the total number of comment in each community is at least time larger than the number of post which suggests a supportive behavior among user
