Link to paper,Score,text
https://link.springer.com/content/pdf/10.1140/epjds/s13688-017-0110-z.pdf,1,data privacy wa a concern for this study strict anonymity wa nearly impossible to guarantee to participant given that usernames and personal photograph posted to instagram often contain identifiable feature we made sure participant were informed of the risk of being personally identified and assured them that no data with personal identifier including usernames would be made public or published in any format
https://dl.acm.org/doi/abs/10.1145/2858036.2858207 ,1,we use public data from reddit personally identifiable information wa removed and content wa deidentified and paraphrased before being reported in the paper for exemplary purpose this work ha been approved by the appropriate institutional review board irb our work doe not make any diagnostic claim related to mental illness or suicide
https://dl.acm.org/doi/abs/10.1145/2702613.2732733,0,we used reddits official api to collect post comment on post and associated metadata from several mental health focused subreddits we build on the data collection methodology we used in in order to arrive at a comprehensive list of subreddits to focus on we utilized reddits native subreddit search feature httpwwwredditcomreddits we searched for subreddits on mental health two researcher familiar with reddit employed an initial filtering step on the search result returned so that we seed on high precision subreddits discussing mental health concern thereafter we focused on a snowball approach to compile a second list of related or similar subreddits that are mentioned in the profile page of the seed subreddits sample of subreddits in all we crawled are given in table note all of these subreddits host public content for the purpose of selfdisclosure detection we also identified subreddits sample listed in table a our control group total of subreddits meaning they are unrelated to mental health topic for sanity check we randomly sampled a set of post from the control subreddits and two researcher familiar with reddit manually checked their content for presence of any mental health content we found that of subreddit content in our sample were not about any mental health concern cohens kappa for interrater agreement wa in all our dataset had post from user in the mental health subreddits and post from user in the control forum for each of the unique user in the mental health forum we further collected all of their reddit postcomment history last postscomments per reddit api limit if their number of post and comment in our dataset wa five or more this gave u user and m postscomments
https://dl.acm.org/doi/abs/10.1145/2702123.2702280,0,in this study we gathered information on depression level of twitter user and their activity history to do this we published a website to administer a questionnaire and disseminated information about the website over twitter in contrast to de choudhury et al who collected data from englishspeaking user through crowdsourcing this study collected data from japanesespeaking volunteer this approach wa used to investigate the extent to which depression risk can be estimated for a population different from the population considered by the prior research figure show a screenshot of our website the website collected the response to a questionnaire to evaluate the degree of depression of the twitter user who participated hereinafter the participant and to collect the history of participant activity on twitter the activity history of participant were collected through the twitter application programming interface api and the questionnaire to determine degree of depression were completed by participant through their web browser before data collection visitor to the website were presented with a written explanation of the aim of the experiment the information that would be collected and how that information would be handled those who consented to become participant after receiving the explanation logged into their individual twitter account through the oauth authorization process next participant were surveyed on gender age occupation and history of depression following which they answered a questionnaire designed to evaluate degree of depression a message called the kokoro score kokoro is a japanese word meaning heart determined on the basis of answer to the questionnaire and information in the collected tweet wa displayed to participant after completion of the questionnaire fig experiment participant were able to tweet the message displayed which made it possible to promote the website over twitter by wordofmouth in a type of snowball sampling the cesd questionnaire wa used to evaluate the degree of depression in the cesd test participant answered question on a likerttype point scale each answer wa assigned a score of point with the sum of the point from all answer used a the score to estimate likelihood of depression several standard exist by which to determine the appropriate cutoff score for identifying depression in this research we regarded a score of point or higher a indicating active depression and a score of point or lower a indicating no active depression these are the same value a used in and give a cutoff score of in addition answer to bdi a depression scale used with characteristic similar to cesd were collected to ensure the reliability of data for each participant score were calculated on both scale with poor correlation regarded a indicating unreliable answer the time taken to answer the questionnaire wa also recorded and those completed in too brief a time were excluded after each participant answered the questionnaire the activity history of that participant on twitter wa collected from twitter by using the api at most tweet were collected for each participant and the number of user following the participant and being followed by the participant were recorded tweet published after the questionnaire wa taken were discarded the website wa opened to the public on december at which time the author publicized it on their twitter account between december and february people participated in the experiment after eliminating participant who did not tweet and participant who answered the questionnaire in fewer than second a previously mentioned to ensure the reliability of the questionnaire answer set of answer remained only the first set of answer wa used for participant who completed the questionnaire more than once a a result data about experiment participant male female aged to mean year standard deviation year were analyzed the correlation between cesd score and bdi score for these participant were high and there were no participant with uncorrelated score so the data for all participant were used excluded datasets are not discussed any further figure show the histogram of cesd score of participant among the participant resp were estimated to have resp not have active depression for an incidence of approximately this incidence is similar to that found by de choudhury et al who identified depression in approximately of participant table give statistic on the activity history of participant
https://www.nature.com/articles/s41598-017-12961-9,1,this study design raised two important issue regarding ethical research practice a it concerned both individual with mental illness and potentially personally identifiable information we were unable to guarantee strict anonymity to participant given that usernames and personal information posted to twitter are often inherently specific to participant identity such a usernames and tweet containing real name a we potentially had the capacity to link study participant identity to sensitive health information study participant were informed of the risk of being personally identified from their social medium data participant were assured that no personal identifier including usernames would ever be made public or published in any format we used turk prime an interface for conducting mturk study to mask participant mturk worker id from our record we made it clear that any link between social medium data and private personal health data would be available only to our team of researcher and participant were able to request to have their data removed at any time
https://aclanthology.org/W14-3214.pdf,0,we used a dataset of nonclinical user who opted into a facebook application mypersonality kosinski and stillwell between june and march completed a item personality questionnaire an international personality item pool ipip proxy to the neopir goldberg and shared access to their status update containing at least word user wrote on average of word total word instance and a subset of user provided gender and age in which were female and the mean age wa the dataset wa divided into training and testing sample in particular the testing sample consisted of a random set of user who wrote at least word and completed the personality measure while the training set contained the remaining user
https://ieeexplore.ieee.org/abstract/document/6784326,0,a clinical community community who are interested in depression and with at least post are extracted from livejournal this is identified through the search community by interest provided by livejournal and result in community with post the clinical community are grouped based on name and description of the individual community depression bipolar selfharm attachmentseparation and suicide see table for statistic the earliest community creation date wa in thus our data set span over year b control community we constructed a control data set using five popular category of community in the livejournal directory we select community who have at least post resulting in community with post this set is called control and the statistic of these community and their description are shown in table
https://www.jmir.org/2017/7/e243/,0,a webbased survey of weibo user wa conducted to ass the respondent suicide risk and emotional distress ie depression anxiety and stress the invitation letter to participate in this survey wa widely sent out to general weibo user by various promotion activity for a weibo user to be eligible for the study she or he had to be year or older by selfreport a renminbi incentive for each complete survey wa provided to boost the respond rate with the respondent consent their weibo post that were posted in the public domain during the month before the survey were downloaded by calling weibo api the survey fulfilled the checklist for reporting result of internet esurveys cherry checklist and detail of the procedure have been reported in previous publication in addition when multiple survey feedback were submitted from the same internet protocol address only the first submission wa used to avoid duplicate participation in contrast to a previous study this study excluded those who posted nothing throughout the month but not those who posted fewer than post eventually data provided by respondent remained for further analysis the study ha obtained ethical approval from the human research ethical review committee at the university of hong kong and the institute review board of the institute of psychology at the chinese academy of science the survey measured respondent suicide probability score depression anxiety stress and weibo suicide communication wsc a the outcome variable in addition the respondent weibo post language feature were extracted a independent variable or feature for machine learning the detail of how those data were obtained are elaborated in the following subsection
https://dl.acm.org/doi/abs/10.1145/3025453.3025909,0,we first obtained a list of ranked major university in the united state by crawling the u news and world report website this list is constructed based on the carnegie classification employed extensively by higher education researcher and using a set of indicator of academic excellence defined by u news the list includes a variety of university spread across the u in different setting eg urban rural and with a wide range of student enrollment size figure a show their geographic distribution a a part of this crawl we also obtained university metadata gender distribution of student average tuition and fee and academic calendar semesterquarter to obtain further information about the nature of the student body we crawled the wikipedia page of all of the university from these page we extracted the size of student enrollment type publicprivate and setting ruralsuburbanurbancity at every institution these definition come from a formal categorization scheme used by the u department of education the student body enrollment size ranged from to with public and private university university were reported to be urban city suburban and rural finally we obtained information on racial diversity of the university from a website known a priceonomics the website calculates the herfindahlhirschman index hhi by combining the raceethnicity distribution of student body at different university with data given from the department of education hhi range from the least diverse a population of all one type to n the most diverse where n is the number of different racial category being analyzed social medium data of university next we obtained social medium data of the above university specifically we focused on the social medium reddit why reddit reddit is known to be a widely used online forum and social medium site among the college student demographic due to it forum structure it is extensively used for both content sharing a well a for obtaining feedback and information from community of interest reddit harbor a variety of community known a subreddits including many dedicated to specific university campus this allows a large sample of post shared by student of a university to be collected in one place our preliminary manual inspection of university subreddits eg rgatech or rkstate revealed that these subreddits are appropriated by student to discus college topic table focusing on these public reddit community also doe not require explicit data collection effort to be coordinated at each of the university site although more student are likely to use facebook due to it largely privately shared content it is challenging to obtain access to a large dataset of a university student next while twitter is also widely adopted without explicit selfreported information it is challenging to identify college student account finally prior work note that semianonymity of reddit enables candid self disclosure around stigmatized topic like mental health initial data acquisition we leveraged the archive of all of reddit data made available on google bigquery bigquery is a cloud based managed data warehouse that allows third party to access large publicly available dataset through simple sqltype query our query grabbed all post ranging between june and february available in the reddit data archive this included post from unique user across all of the university with a mean of post and unique user per subreddit filling the gap in subreddit data the second step of our data collection process focused on identifying subreddits with insufficient data and supplementing them through additional alternative data collection through reddits official api httpswwwredditcomdevapi we obtained the most recent number of subscriber in the university subreddits a of july then to investigate if and to what extent some subreddits may have had unusually low data a given in step we determined the median unique user to subscriber ratio in each subreddit this allows u to capture the subreddits where the subscriber count is high however the data obtained is not sufficiently representative for subreddits with unique user to subscriber ratio under median in all we performed a onetime data collection using the reddit api this gave u a set of at most most recent post for each subreddit with a total of post added to the data obtained in step following deduplication we note that this procedure did not skew the yearly distribution of data across the subreddits the skew yearly rate of change before and after data filling were and respectively which were found to be statistically equivalent based on a twosample equivalence test p p a test that us two onesided ttests on the beforeafter yearly rate of change from both side of a chosen difference interval
https://ieeexplore.ieee.org/abstract/document/7752434,0,to train our model we require information from two different type of user patient and nonpatients therefore we employed a combined manual effort and keyword matching data collection approach to efficiently collect data for these user for the collection of patient we manually collect the community portal relevant to both mental disorder from these portal follower list we select the selfreported user who explicitly state in their profile description that they suffer from a mental illness ie for a given user we are checking if hisher profile contains any keyword related to a target disorder eg borderline bpd bipolar nonpatients are referred to a random active twitter user who are not explicitly stating that they are suffering from bipolar disorder hereinafter referred to a bd or borderline personality disorder hereinafter referred to a bpd to obtain these user we randomly sampled twitter id thereafter we proceeded to download the tweet from the selected id after the user have been identified we manually label them into one of two category patient a person who is suffering from a mental disorder notrelated any user who we dont consider to be a patient lastly after having obtained the final list of patient we retrieve their tweet these step are applied for the collection of both bpd and bd patient datasets
https://www.nature.com/articles/s41598-020-68764-y,1,we collected post data from the following six mentalhealthrelated subreddits each of which is reported to be associated with a specific disorder rdepression ranxiety rbipolar rbpd rschizophrenia and rautism in addition we further collected post data from the most popular healthrelated subreddit rmentalhealth to analyze post with general health information from each subreddit we collected all the user id who had at least one post related to the mental health along with user id we also collected title and post using the pushshiftapi note that all the user information is anonymized hence no personally identifiable information wa not included we followed all the anonymization process guided by the sungkyunkwan university institutional review board irb overall the current study collected information from user who wrote post in the seven subreddits from january to december table summarizes the information of collected data
https://aclanthology.org/W19-3013.pdf,1,the majority of social medium analysis approach try to extract signal from individual post and thus do not need to record any personal information however a we start moving towards userlevel analysis we are collecting and storing complete record of social medium user communication even though this information is publicly available people might not be consciously aware of the implication of sharing all their data and certainly have not given explicit consent for their data to be analyzed in aggregate this is even more pertinent for analysis involving sensitive information eg health related issue a it ha been demonstrated by the recent incident involving company inadvertently sharing or failing to protect user personal data there is a serious danger of abuse and exploitation for system that collect and store large amount of personal data even though this is in large part an ethical question there are technical solution that can be used to partially address this issue one is to use anonymization technique to obfuscate any detail that allow third party even analyst to identify the individual that are involved in the study another is to store only abstract representation which can still be updated and consumed by predictive model and discard the actual content in regard to consent there are initiative to support voluntary data donation for research purpose eg the our data help program
https://link.springer.com/chapter/10.1007/978-3-319-67186-4_6,1,we analyze two datasets user community on reddit and journal from a mental health journalling mobile app we omit the name of the app for privacy and we refer to it a the journalling app reddit is a social medium platform that wa originally used for sharing and rating content such a news documentary and music user post in and subscribe to selforganized community known a subreddits subscribing to a subreddit allows a user to view all post from that subreddit an advantage of analyzing reddit data is that the subreddits are labelled according to their topic utilizing curated list from volunteer reddit user we crawled all subreddits related to mental health a well a all subreddits linked by these community the second dataset consists of anonymized journal post from a mobile app designed to help people track their mood and share them anonymously if they desire for each journal post the app requires the user to label the journal post with at least one mood selected from a prepopulated list including happy sad etc we obtained all journal and the associated mood written between january and january this amount to over million journal written by approximately user figure plot the number of journal posted over time most of the journal were written in the first half of although we inspected topic distribution per month and did not find seasonal effect towards the beginning of many new user registered on the app and eventually stopped using it like weightloss and productivity apps we believe this influx is tied to user looking to improve their habit a a new year resolution each journal can be set to be private or public visible to all other user of the app roughly one third of all journal are public figure plot the number of user on the yaxis versus the percentage of journal they posted publicly most user are either mostly private or mostly public most journal are relatively short just like twitter post that are at most character the average length of a journal with text in it is character there are roughly journal that have no text only a mood label we observed that private user tend to write journal that are slightly but statistically significantly longer than those written by public user by approximately character figure show the distribution of journal length where the spike correspond to length mood only character the default limit set by the app and character set a the maximum for visualization purpose user of the app can optionally enter their location age and gender while most user did not enter this information we found that those who revealed their location are mostly from north america those who revealed their gender are predominantly female and those who revealed their age have an average age of
https://dl.acm.org/doi/abs/10.1145/2556288.2557214,0,a key challenge of this research wa to identify the different health condition on which people seek and share information via search engine and twitter respectively we identified four broad category of condition based on their severity and type symptom of major disease benign explanation nonlifethreatening illness serious illness and disability we also characterized each condition by the degree of perceived social stigma provided by thirdparty judge our final list contained condition
